Title,Channel,Theme,Publish Date,Status,CTA,Asset URL,Linked Pilot,KPI Views,KPI Clicks,KPI Leads
"MME: The Bounded Tag Graph Revolution","LinkedIn, Blog","MME",2025-01-20,"Scheduled","Try MME Packer","https://github.com/mme/packer","","","",""
"Why Orchestration Platforms Need MME","LinkedIn, X","Benchmark",2025-01-22,"Drafting","Join our pilot program","","TechCorp Orchestration","","",""
"Enhanced Search: Beyond Word-by-Word","Blog","MME",2025-01-25,"In Review","Test enhanced search","https://docs.mme.dev/enhanced-search","","","",""
"Security in Multi-Tenant AI Systems","LinkedIn, Blog","Security",2025-01-27,"Idea","Learn about MME security","","SecureBank Platform","","",""
"Case Study: DevOps Pro 60% Faster Deployments","LinkedIn, Blog, Talk","Case Study",2025-01-30,"Drafting","Read the full case study","https://mme.dev/case-studies/devops-pro","DevOps Pro","","",""
"API Standardization: The Path to SDKs","Blog","SDK",2025-02-01,"Idea","Explore our APIs","https://docs.mme.dev/api","","","",""
"Regulated Industries and AI: A Perfect Match","LinkedIn, X","Pilot",2025-02-03,"Idea","Join our regulated pilot","","GovTech Solutions","","",""
"The Future of Enterprise AI Orchestration","Talk","MME",2025-02-05,"Idea","Watch the talk","https://youtube.com/mme-talk","","","",""
"MME vs Vector Search: Why Not Both?","Blog","MME",2025-02-08,"Idea","Try hybrid search","https://docs.mme.dev/hybrid-search","","","",""
"From Pilot to Production: AI Platform Co's Journey","LinkedIn, Blog","Case Study",2025-02-10,"Idea","Read the transformation","https://mme.dev/case-studies/ai-platform","AI Platform Co","","",""
